Stage,Model,Improvement Applied,Key Parameters,Feature Strategy,MAE,RMSE,MAPE,Why It Matters
1,Seasonal Naive Baseline,Benchmark forecast using same-week historical behavior.,No complex tuning; simple seasonal benchmark.,Same weekday historical pattern.,1146.609667,1491.278691,22.475447,Establishes the minimum reference point for evaluating improvement.
2,SARIMAX Basic,Added statistical time-series structure.,"order=(1,1,1), seasonal_order=(1,0,1,7)",Weekly seasonality and temporal behavior.,937.932934,1255.463102,18.498093,Improved because restaurant demand has temporal and weekly seasonal patterns.
3,Hybrid SARIMAX + RF Lag Residual,Added Random Forest residual correction to SARIMAX.,"RF n_estimators=300, max_features=sqrt, min_samples_leaf=3",SARIMAX temporal structure + nonlinear lag-based residual learning.,838.278509,1143.613609,16.197925,Best result because it combines time-series structure with nonlinear residual correction.
4,KPI-Based Net Sales Forecast,Predicted net sales from predicted transactions and predicted average ticket.,Random Forest KPI models.,Transactions + average ticket decomposition.,1004.911588,1299.964685,20.993012,More explainable for managers because it decomposes sales into operational drivers.
5,Conformal Prediction Method,Planned next improvement to add prediction intervals.,Lower and upper prediction bounds around point forecasts.,Uncertainty-aware forecasting.,,,,Will improve operational usefulness by showing demand ranges instead of only point forecasts.
