Stage,Model,Improvement Applied,Key Parameters,Feature Strategy,MAE,RMSE,MAPE,Why It Matters,Evaluation Type,Interval Coverage,Conformal Margin,Average Interval Width,Average Absolute Error
1,Seasonal Naive Baseline,Benchmark forecast using same-week historical behavior.,No complex tuning; simple seasonal benchmark.,Same weekday historical pattern.,1146.609667,1491.278691,22.475447,Establishes the minimum reference point for evaluating improvement.,Point forecast,N/A,N/A,N/A,N/A
2,SARIMAX Basic,Added statistical time-series structure.,"order=(1,1,1), seasonal_order=(1,0,1,7)",Weekly seasonality and temporal behavior.,937.932934,1255.463102,18.498093,Improved because restaurant demand has temporal and weekly seasonal patterns.,Point forecast,N/A,N/A,N/A,N/A
3,Hybrid SARIMAX + RF Lag Residual,Added Random Forest residual correction to SARIMAX.,"RF n_estimators=300, max_features=sqrt, min_samples_leaf=3",SARIMAX temporal structure + nonlinear lag-based residual learning.,838.278509,1143.613609,16.197925,Best result because it combines time-series structure with nonlinear residual correction.,Point forecast,N/A,N/A,N/A,N/A
4,KPI-Based Net Sales Forecast,Predicted net sales from predicted transactions and predicted average ticket.,Random Forest KPI models.,Transactions + average ticket decomposition.,1004.911588,1299.964685,20.993012,More explainable for managers because it decomposes sales into operational drivers.,Point forecast,N/A,N/A,N/A,N/A
5,Conformal Prediction Interval,Implemented validation-based conformal prediction intervals around the Hybrid SARIMAX + Random Forest forecast.,"nominal_level=90%, alpha=0.10, calibration_residuals=202, conformal_margin=$2,996.68",Uses rolling backtesting absolute residuals to estimate uncertainty around the point forecast.,N/A - interval method,N/A - interval method,N/A - interval method,"Adds uncertainty-aware planning through prediction intervals. It is evaluated by coverage, conformal margin, and interval width, not by MAE/RMSE/MAPE as a separate point-forecast model.",Interval method,96.67%,"$2,996.68","$5,993.35",$876.86
